{
  "schemaVersion": 1,
  "meta": {
    "updated": "2026-08-12",
    "note": "See data/AUTHORING.md in the repository root for the card format and how to add cards."
  },
  "decks": [
    {
      "id": "kraehen",
      "name": "Das Lied der Krähen",
      "filter": { "sources": ["Das Lied der Krähen"] }
    },
    {
      "id": "kraehen-kap-1",
      "name": "Krähen · Kapitel 1",
      "filter": { "sources": ["Das Lied der Krähen"], "chapters": ["1"] }
    },
    {
      "id": "verben",
      "name": "Nur Verben",
      "filter": { "tags": ["verb"] }
    }
  ],
  "cards": [
    {
      "id": "die-gasse",
      "de": "die Gasse",
      "pos": "noun",
      "forms": "die Gasse, die Gassen",
      "en": "alley, narrow lane",
      "syn": ["die Seitenstraße", "der Durchgang"],
      "ex1": "Sie verschwanden in einer engen Gasse, bevor die Wachen um die Ecke kamen. [They disappeared into a narrow alley before the guards came round the corner.]",
      "ex2": "Hinter dem Markt gibt es eine kleine Gasse mit einem Café.",
      "notiz": "Enger als eine Straße. „Gasse\" wird auch übertragen benutzt: jemandem eine Gasse bahnen.",
      "source": "Das Lied der Krähen",
      "chapter": "1",
      "tags": ["b2", "noun", "ort"],
      "added": "2026-08-12"
    },
    {
      "id": "der-hinterhalt",
      "de": "der Hinterhalt",
      "pos": "noun",
      "forms": "der Hinterhalt, die Hinterhalte",
      "en": "ambush",
      "syn": ["die Falle"],
      "ex1": "Der ganze Auftrag war von Anfang an ein Hinterhalt gewesen. [The whole job had been an ambush from the start.]",
      "ex2": "Die Polizei geriet in einen Hinterhalt.",
      "notiz": "Fast immer mit „in einen Hinterhalt geraten\" oder „aus dem Hinterhalt angreifen\".",
      "source": "Das Lied der Krähen",
      "chapter": "1",
      "tags": ["b2", "noun"],
      "added": "2026-08-12"
    },
    {
      "id": "schmuggeln",
      "de": "schmuggeln",
      "pos": "verb",
      "forms": "schmuggelte, hat geschmuggelt",
      "en": "to smuggle",
      "syn": ["einschleusen"],
      "ex1": "Er schmuggelte seit Jahren Waren durch den Hafen, ohne je erwischt zu werden. [He had been smuggling goods through the harbour for years without ever being caught.]",
      "ex2": "Sie hat Schokolade ins Kino geschmuggelt.",
      "notiz": "Regelmäßig. Oft mit „durch\" oder „nach\": etwas über die Grenze schmuggeln.",
      "source": "Das Lied der Krähen",
      "chapter": "1",
      "tags": ["b2", "verb"],
      "added": "2026-08-12"
    },
    {
      "id": "die-beute",
      "de": "die Beute",
      "pos": "noun",
      "forms": "die Beute (meist Singular)",
      "en": "loot, spoils; prey",
      "syn": ["der Raub", "die Ausbeute"],
      "ex1": "Sie stritten über die Beute, noch bevor sie sie in den Händen hielten. [They argued over the loot before they even had it in hand.]",
      "ex2": "Der Fuchs schleppte seine Beute in den Bau.",
      "notiz": "Kein Plural im Alltag. Doppelte Bedeutung: Diebesgut und Jagdbeute.",
      "source": "Das Lied der Krähen",
      "chapter": "2",
      "tags": ["b2", "noun"],
      "added": "2026-08-12"
    },
    {
      "id": "zoegern",
      "de": "zögern",
      "pos": "verb",
      "forms": "zögerte, hat gezögert",
      "en": "to hesitate",
      "syn": ["schwanken", "unschlüssig sein"],
      "ex1": "Sie zögerte nur einen Augenblick, dann sprang sie. [She hesitated only a moment, then jumped.]",
      "ex2": "Zögere nicht, mich anzurufen.",
      "notiz": "Ohne Präposition. „Zögern zu + Infinitiv\": Er zögerte zu antworten.",
      "source": "Das Lied der Krähen",
      "chapter": "2",
      "tags": ["b2", "verb"],
      "added": "2026-08-12"
    },
    {
      "id": "das-geruecht",
      "de": "das Gerücht",
      "pos": "noun",
      "forms": "das Gerücht, die Gerüchte",
      "en": "rumour",
      "syn": ["das Gerede", "die Sage"],
      "ex1": "In der Stadt hielt sich hartnäckig das Gerücht, er sei längst tot. [In the city a stubborn rumour persisted that he had long been dead.]",
      "ex2": "Es geht das Gerücht, dass sie kündigt.",
      "notiz": "Häufige Wendung: „Es geht das Gerücht, dass …\" oder „ein Gerücht in die Welt setzen\".",
      "source": "Das Lied der Krähen",
      "chapter": "2",
      "tags": ["b2", "noun"],
      "added": "2026-08-12"
    },
    {
      "id": "ruecksichtslos",
      "de": "rücksichtslos",
      "pos": "adj",
      "forms": "rücksichtsloser, am rücksichtslosesten",
      "en": "ruthless, inconsiderate",
      "syn": ["skrupellos", "brutal"],
      "ex1": "Er verfolgte seinen Plan rücksichtslos, ganz gleich, wer dabei zurückblieb. [He pursued his plan ruthlessly, no matter who was left behind.]",
      "ex2": "Er fährt rücksichtslos und viel zu schnell.",
      "notiz": "Gegenteil: rücksichtsvoll. Im Verkehr eher „inconsiderate\", bei Personen „ruthless\".",
      "source": "Das Lied der Krähen",
      "chapter": "3",
      "tags": ["b2", "adjektiv"],
      "added": "2026-08-12"
    },
    {
      "id": "der-auftrag",
      "de": "der Auftrag",
      "pos": "noun",
      "forms": "der Auftrag, die Aufträge",
      "en": "assignment, commission, order",
      "syn": ["die Aufgabe", "die Bestellung"],
      "ex1": "Der Auftrag war einfach beschrieben und fast unmöglich auszuführen. [The job was simply described and nearly impossible to carry out.]",
      "ex2": "Die Firma hat einen großen Auftrag bekommen.",
      "notiz": "„Im Auftrag von\" = on behalf of. Umlaut im Plural: die Aufträge.",
      "source": "Das Lied der Krähen",
      "chapter": "3",
      "tags": ["b2", "noun", "arbeit"],
      "added": "2026-08-12"
    },
    {
      "id": "verraten",
      "de": "verraten",
      "pos": "verb",
      "forms": "verriet, hat verraten",
      "en": "to betray; to give away (a secret)",
      "syn": ["hintergehen", "preisgeben"],
      "ex1": "Einer von ihnen hatte sie verraten, und jeder verdächtigte jeden. [One of them had betrayed the others, and everyone suspected everyone.]",
      "ex2": "Verrate mir nicht das Ende des Films!",
      "notiz": "Unregelmäßig, kein „ge-\" im Partizip. Zwei Bedeutungen: Menschen verraten, aber auch ein Geheimnis verraten.",
      "source": "Das Lied der Krähen",
      "chapter": "3",
      "tags": ["b2", "verb"],
      "added": "2026-08-12"
    },
    {
      "id": "die-schuld",
      "de": "die Schuld",
      "pos": "noun",
      "forms": "die Schuld, die Schulden (Plural = Geldschulden)",
      "en": "guilt, blame; (plural) debts",
      "syn": ["die Verantwortung", "die Verbindlichkeit"],
      "ex1": "Er zahlte seine Schulden nie mit Geld zurück, sondern immer mit Gefallen. [He never repaid his debts with money, only with favours.]",
      "ex2": "Es ist nicht deine Schuld.",
      "notiz": "Falscher Freund im Plural: „Schulden\" sind Geldschulden, nicht mehrere Schuldgefühle.",
      "source": "Das Lied der Krähen",
      "chapter": "4",
      "tags": ["b2", "noun"],
      "added": "2026-08-12"
    },
    {
      "id": "heimtueckisch",
      "de": "heimtückisch",
      "pos": "adj",
      "forms": "heimtückischer, am heimtückischsten",
      "en": "insidious, treacherous",
      "syn": ["hinterhältig", "tückisch"],
      "ex1": "Der Plan war heimtückisch genug, um zu funktionieren. [The plan was treacherous enough to work.]",
      "ex2": "Die Krankheit verläuft oft heimtückisch.",
      "notiz": "Stärker als „unehrlich\": impliziert versteckte Bosheit. Auch für Krankheiten üblich.",
      "source": "Das Lied der Krähen",
      "chapter": "4",
      "tags": ["c1", "adjektiv"],
      "added": "2026-08-12"
    },
    {
      "id": "sich-lohnen",
      "de": "sich lohnen",
      "pos": "verb",
      "forms": "lohnte sich, hat sich gelohnt",
      "en": "to be worth it, to pay off",
      "syn": ["sich rentieren", "sich auszahlen"],
      "ex1": "Das Risiko würde sich lohnen, sagte er, und keiner von ihnen glaubte ihm. [The risk would pay off, he said, and not one of them believed him.]",
      "ex2": "Der frühe Aufstand hat sich gelohnt.",
      "notiz": "Immer reflexiv. „Es lohnt sich, früh zu buchen.\"",
      "source": "Das Lied der Krähen",
      "chapter": "4",
      "tags": ["b2", "verb"],
      "added": "2026-08-12"
    }
  ]
}
